Truth,Decoded
Buongiorno io sono Mario,buonorn io so mario
Le auguro una buona giornata,eagrna ora
A che ora arriva il pullman,e a e e io il
Prego,pero
Tutto bene grazie,tutto e grazie
Dovrebbe arrivare tra qualche minuto,drbrarvr e e un minuto
"Certo volentieri, io lo prendero macchiato",ptoiro lo bene mario
Quanto costa il biglietto,lo e lo io
Prendiamo un caffe al bar,e lo a a
Dovrebbe arrivare tra qualche minuto,lo e bar a due
Piacere Luigi come stai,un e io si le si
Salve quanto costa quell articolo,e e lo
Prego,e lei
Buonasera io sono Mario,e lo mario
Si grazie e arrivederci,lo io
Tutto bene tu,e e lo e un
