Truth,Decoded
Va bene grazie lo stesso,e non tu
Salve quanto costa quell articolo,sono ora come maicito
Dovrebbe arrivare tra qualche minuto,lo e che tra e le io
Le auguro una buona giornata,le auguoua una io a
E in offerta costa dieci euro,e in un una a e io euro
"Certo volentieri, io lo prendero macchiato",puroni io io lo lo mario
Si grazie e arrivederci,si e e io ecco
Tutto bene tu,tutto e tu
Piacere Luigi come stai,peacuo un il stai
Purtroppo non lo so pero potresti chiedere all autista,purtroppo lo lo lo lo tu come e autista
Va bene grazie lo stesso,va bearai lo stesso
Perfetto vorrei comprarne due.,pero ora crmare due
E in offerta costa dieci euro,e in ora costa io io euro
Certo ecco a lei vuole un sacchetto,lo e a a come lo stcheto
Salve quanto costa quell articolo,pero una a un rtilo
Buonasera io sono Mario,buona io sono mario
